{
  "catalog_version": "english_source_families_v2",
  "catalog_status": "candidate_review_only",
  "catalog_scope": {
    "lang_code": "en",
    "lang_name": "English",
    "variable_capacity_model": true,
    "fixed_target_count": null,
    "review_rule": "each_seed_checked_individually_before_db_insert",
    "cross_seed_traversal_enabled": true,
    "cross_language_traversal_enabled": true
  },
  "seed_contract_basis": {
    "source_table": "seed.source",
    "seed_url_table": "seed.seed_url",
    "source_unique_key": "source_code",
    "seed_unique_key": [
      "source_id",
      "canonical_url_sha256"
    ]
  },
  "crawl_review_policy": {
    "policy_version": "en_review_policy_v1",
    "goal": "avoid_alarm_patterns_and_unnecessary_resource_consumption",
    "review_mode_before_insert": "lightweight_live_check_only",
    "host_level_budgeting_required": true,
    "cross_host_round_robin_required": true,
    "same_host_back_to_back_checks_avoided": true,
    "browser_use_policy": "browser_only_if_http_path_is_insufficient",
    "robots_first": true,
    "etag_last_modified_preferred_when_available": true,
    "suggested_review_order": [
      "robots_check",
      "lightweight_http_check",
      "html_surface_check",
      "only_if_needed_browser_check"
    ],
    "minimum_spacing_guidance": {
      "same_host_review_spacing_seconds": 120,
      "same_source_review_spacing_seconds": 30
    }
  },
  "source_families": [
    {
      "source_family_code": "fiata_org",
      "source_family_name": "FIATA",
      "source_status": "active",
      "source_root_url": "https://fiata.org/",
      "source_host": "fiata.org",
      "source_category": "association_directory",
      "allowed_schemes": [
        "https",
        "http"
      ],
      "default_priority": 230,
      "default_recrawl_interval": "14 days",
      "default_max_depth": 2,
      "notes": "Single source family for FIATA ecosystem. Country directory paths stay below this family.",
      "family_metadata": {
        "lang_code": "en",
        "trust_tier": "A",
        "discovery_value": "high",
        "noise_risk": "low",
        "manual_review_priority": 10,
        "live_check_required": true,
        "family_review_state": "needs_live_check",
        "host_budget_group": "host:fiata.org",
        "cross_seed_traversal_allowed": true,
        "cross_language_traversal_allowed": true
      },
      "seed_surfaces": [
        {
          "surface_code": "directory_root",
          "surface_type": "directory",
          "surface_name": "FIATA Directory Root",
          "surface_metadata": {
            "surface_scope": "global",
            "country_code": null
          },
          "seed_urls": [
            {
              "seed_type": "entrypoint",
              "submitted_url": "https://fiata.org/directory/",
              "canonical_url": "https://fiata.org/directory/",
              "is_enabled": true,
              "priority": 230,
              "max_depth": 2,
              "recrawl_interval": "14 days",
              "seed_metadata": {
                "lang_code": "en",
                "review_state": "needs_live_check"
              },
              "notes": "Global FIATA directory root entrypoint."
            }
          ]
        },
        {
          "surface_code": "directory_country_gb",
          "surface_type": "country_member_directory",
          "surface_name": "FIATA Directory United Kingdom",
          "surface_metadata": {
            "surface_scope": "country",
            "country_code": "GB"
          },
          "seed_urls": [
            {
              "seed_type": "entrypoint",
              "submitted_url": "https://fiata.org/directory/gb/",
              "canonical_url": "https://fiata.org/directory/gb/",
              "is_enabled": true,
              "priority": 225,
              "max_depth": 2,
              "recrawl_interval": "14 days",
              "seed_metadata": {
                "lang_code": "en",
                "review_state": "needs_live_check"
              },
              "notes": "FIATA directory page for United Kingdom."
            }
          ]
        },
        {
          "surface_code": "directory_country_de",
          "surface_type": "country_member_directory",
          "surface_name": "FIATA Directory Germany",
          "surface_metadata": {
            "surface_scope": "country",
            "country_code": "DE"
          },
          "seed_urls": [
            {
              "seed_type": "entrypoint",
              "submitted_url": "https://fiata.org/directory/de/",
              "canonical_url": "https://fiata.org/directory/de/",
              "is_enabled": true,
              "priority": 220,
              "max_depth": 2,
              "recrawl_interval": "14 days",
              "seed_metadata": {
                "lang_code": "en",
                "review_state": "needs_live_check"
              },
              "notes": "FIATA directory page for Germany."
            }
          ]
        },
        {
          "surface_code": "directory_country_fr",
          "surface_type": "country_member_directory",
          "surface_name": "FIATA Directory France",
          "surface_metadata": {
            "surface_scope": "country",
            "country_code": "FR"
          },
          "seed_urls": [
            {
              "seed_type": "entrypoint",
              "submitted_url": "https://fiata.org/directory/fr/",
              "canonical_url": "https://fiata.org/directory/fr/",
              "is_enabled": true,
              "priority": 220,
              "max_depth": 2,
              "recrawl_interval": "14 days",
              "seed_metadata": {
                "lang_code": "en",
                "review_state": "needs_live_check"
              },
              "notes": "FIATA directory page for France."
            }
          ]
        }
      ]
    },
    {
      "source_family_code": "bifa_org",
      "source_family_name": "BIFA",
      "source_status": "active",
      "source_root_url": "https://bifa.org/",
      "source_host": "bifa.org",
      "source_category": "association_directory",
      "allowed_schemes": [
        "https",
        "http"
      ],
      "default_priority": 220,
      "default_recrawl_interval": "14 days",
      "default_max_depth": 2,
      "notes": "Single source family for BIFA membership ecosystem.",
      "family_metadata": {
        "lang_code": "en",
        "trust_tier": "A",
        "discovery_value": "high",
        "noise_risk": "low",
        "manual_review_priority": 10,
        "live_check_required": true,
        "family_review_state": "needs_live_check",
        "host_budget_group": "host:bifa.org",
        "cross_seed_traversal_allowed": true,
        "cross_language_traversal_allowed": true
      },
      "seed_surfaces": [
        {
          "surface_code": "members_directory",
          "surface_type": "member_directory",
          "surface_name": "BIFA Members Directory",
          "surface_metadata": {
            "surface_scope": "directory"
          },
          "seed_urls": [
            {
              "seed_type": "entrypoint",
              "submitted_url": "https://bifa.org/members/",
              "canonical_url": "https://bifa.org/members/",
              "is_enabled": true,
              "priority": 220,
              "max_depth": 2,
              "recrawl_interval": "14 days",
              "seed_metadata": {
                "lang_code": "en",
                "review_state": "needs_live_check"
              },
              "notes": "BIFA members directory."
            }
          ]
        },
        {
          "surface_code": "member_search_results",
          "surface_type": "member_search",
          "surface_name": "BIFA Member Search Results Surface",
          "surface_metadata": {
            "surface_scope": "search_surface"
          },
          "seed_urls": [
            {
              "seed_type": "search_surface",
              "submitted_url": "https://bifa.org/membership/member-search/search-results/",
              "canonical_url": "https://bifa.org/membership/member-search/search-results/",
              "is_enabled": true,
              "priority": 210,
              "max_depth": 2,
              "recrawl_interval": "14 days",
              "seed_metadata": {
                "lang_code": "en",
                "review_state": "needs_live_check"
              },
              "notes": "BIFA member search results surface."
            }
          ]
        },
        {
          "surface_code": "recent_new_members",
          "surface_type": "listing_index",
          "surface_name": "BIFA Recent New Members",
          "surface_metadata": {
            "surface_scope": "recent_members"
          },
          "seed_urls": [
            {
              "seed_type": "listing_index",
              "submitted_url": "https://bifa.org/membership/recent-new-members/",
              "canonical_url": "https://bifa.org/membership/recent-new-members/",
              "is_enabled": true,
              "priority": 200,
              "max_depth": 1,
              "recrawl_interval": "30 days",
              "seed_metadata": {
                "lang_code": "en",
                "review_state": "needs_live_check"
              },
              "notes": "BIFA recent new members discovery surface."
            }
          ]
        }
      ]
    },
    {
      "source_family_code": "iela_org",
      "source_family_name": "IELA",
      "source_status": "active",
      "source_root_url": "https://www.iela.org/",
      "source_host": "www.iela.org",
      "source_category": "association_directory",
      "allowed_schemes": [
        "https",
        "http"
      ],
      "default_priority": 215,
      "default_recrawl_interval": "21 days",
      "default_max_depth": 2,
      "notes": "IELA global exhibition logistics membership surface.",
      "family_metadata": {
        "lang_code": "en",